original	translation	mean	source_lang	target_lang
Other products include sugarcane, strawberries, tomatoes and celery.	ఇతర ఉత్పత్తులలో చక్కెర గడ్డి, స్ట్రాబెర్రీ, టమోటాలు, సెలెరీ ఉన్నాయి.	90.0	en	telugu
After the Anglo Bhutan War, the territory was virtually under the command of the British forces.	ఆంగ్ల భూటాన్ యుద్ధం తరువాత, ఈ భూభాగం వాస్తవంగా బ్రిటిష్ దళాల ఆదేశం క్రింద ఉంది.	80.0	en	telugu
While the groups might have migrated to the area at different times and as distinctly different ethnic groups, the current distinctions are contemporary socio-cultural constructs.	ఈ సమూహాలు వేర్వేరు సమయాల్లో మరియు విభిన్న జాతి సమూహాలుగా ఈ ప్రాంతానికి వలస వచ్చినప్పటికీ, ప్రస్తుత విభేదాలు సమకాలీన సాంఘిక-సాంస్కృతిక నిర్మాణాలు.	80.0	en	telugu
In this battle multiple opponents viz.	ఈ యుద్ధంలో బహుళ ప్రత్యర్థులు, అవి.	53.3333333333333	en	telugu
The majority of the species in the collection belong to the plant families Cupressaceae, Pinaceae, Fabaceae, Caprifoliaceae, Oleaceae and Rosaceae, and the genera Juniperus, Quercus, Syringa and Clematis are particularly well represented.	సేకరణలో ఉన్న జాతుల మెజారిటీ కప్రెసాసీ, పినాసీ, ఫాబసీ, కాప్రిఫాలియాసీ, ఒలీయాసీ మరియు రోసాసీ కుటుంబాలకు చెందినవి, మరియు జునిపెరస్, క్వెర్కస్, సిరింగా మరియు క్లెమాటిస్ జాతులు ప్రత్యేకంగా బాగా ప్రాతినిధ్యం వహిస్తాయి.	70.0	en	telugu
The national team is the Mozambique national football team.	జాతీయ జట్టు మొజాంబిక్ జాతీయ ఫుట్బాల్ జట్టు.	80.0	en	telugu
Ton Koopman is a Dutch conductor, organist and harpsichordist.	టోన్ కూప్మాన్ ఒక డచ్ డైరెక్టర్, ఆర్గనైస్ట్ మరియు కీబోరెక్స్.	90.0	en	telugu
The Romans made a distinction between the Roman provinces of downstream Germania Inferior (nowadays part of Belgium and the Netherlands) and upstream Germania Superior (nowadays part of Germany).	రోమన్లు జర్మనీ ఇన్ఫర్నియర్ (ఇప్పుడు బెల్జియం మరియు నెదర్లాండ్స్లో భాగం) మరియు జర్మనీ సూపరీయర్ (ఇప్పుడు జర్మనీలో భాగం) యొక్క రోమన్ ప్రావిన్సుల మధ్య వ్యత్యాసం చేసారు.	68.3333333333333	en	telugu
Muslims are divided between those of Malagasy ethnicity, Indians, Pakistanis and Comorans.	ముస్లింలు మాలాగసీ జాతి, భారతీయులు, పాకిస్తానీలు, కామూర్ల మధ్య విభజించబడ్డారు.	80.0	en	telugu
There is, however, disagreement about who founded the village.	అయితే, ఈ గ్రామాన్ని ఎవరు స్థాపించారు అనే అంశంపై వివాదం ఉంది.	80.0	en	telugu
During the reigns of Albert I and Baudouin, the Belgian royal family had a reputation of deeply rooted Catholicism.	ఆల్బర్ట్ I మరియు బాడూయిన్ పాలనలో, బెల్జియన్ రాజ కుటుంబం లోతైన మూలాలున్న కాథలిక్కుల పేరును కలిగి ఉంది.	75.0	en	telugu
He then ventured into Telugu cinema and composed songs and background score for around 25 films in three South Indian languages.	ఆ తర్వాత తెలుగు సినిమా రంగంలోకి అడుగుపెట్టాడు. దక్షిణ భారత మూడు భాషల్లో 25 సినిమాలకు పాటలు, బ్యాక్గ్రౌండ్ స్కోర్ రాశాడు.	85.0	en	telugu
It lies on the Gudur–Katpadi branch line and is administered under Guntakal railway division of South Coast Railway zone.	ఇది గుదుర్ కత్తపడ్డీ శాఖ లైన్లో ఉంది మరియు దక్షిణ తీర రైల్వే జోన్ యొక్క గుంటకాల్ రైల్వే విభాగం కింద నిర్వహించబడుతుంది.	70.0	en	telugu
Naturally occurring ingredients contain various amounts of molecules called proteins, carbohydrates and fats.	సహజంగా సంభవించే పదార్ధాలలో ప్రోటీన్లు, కార్బోహైడ్రేట్లు మరియు కొవ్వులు అని పిలువబడే వివిధ పరిమాణాలలో అణువులు ఉంటాయి.	81.3333333333333	en	telugu
His successor Said bin Sultan increased Omani Arab influence in the region, moving his administration to nearby Zanzibar, which came under Omani rule.	అతని వారసుడు సయిద్ బిన్ సుల్తాన్ ఈ ప్రాంతంలో ఒమన్ అరబ్ ప్రభావం పెరిగి, తన పరిపాలనను సమీపంలోని జంజిబార్కు తరలించాడు, ఇది ఒమన్ పాలనలో వచ్చింది.	86.0	en	telugu
He studied at the Theosophical High School at Adayar in Madras and later enrolled at the Government Arts College at Anantapur, an affiliate of the University of Madras, as an undergraduate.	అతను మద్రాస్ లోని అడయార్ లోని థియోసాఫిక్ హై స్కూల్లో చదువుకున్నాడు. తరువాత మద్రాస్ విశ్వవిద్యాలయం అనుబంధ సంస్థ అయిన అనంతపూర్ లోని ప్రభుత్వ కళల కళాశాలలో అండర్గ్రాడ్యుయేట్గా చేరాడు.	78.3333333333333	en	telugu
[citation needed] Kulothunga II preferred to live in Chidambaram rather than the royal capital at Gangaikonda Cholapuram.	[మార్చు అవసరం] గంగాకోండ చోలాపురం రాజధాని కంటే చిదంబరం లో నివసించాలని కులోతుంగ II ఇష్టపడతాడు.	70.0	en	telugu
Gandhara was often linked politically with the neighboring regions of Kashmir and Kamboja.	గాంధారాను తరచూ పొరుగు ప్రాంతమైన కాశ్మీర్, కంబోజాలతో రాజకీయ సంబంధాలు ఏర్పడ్డాయి.	60.0	en	telugu
"Marxist Friedrich Engels wrote: ""I have learned more [from Balzac] than from all the professional historians, economists and statisticians put together""."	"మార్క్సిస్ట్ ఫ్రిడ్రిచ్ ఎంగెల్స్ ఇలా రాశాడుః ""అన్ని వృత్తిపరమైన చరిత్రకారులు, ఆర్థికవేత్తలు మరియు గణాంకవేత్తల నుండి నేను నేర్చుకున్న దానికంటే ఎక్కువ [బాల్జాక్] నుండి నేర్చుకున్నాను""."	74.0	en	telugu
The then Prime Minister Indira Gandhi argued for the abolition based on equal rights for all citizens and the need to reduce the government's revenue deficit.	అప్పటి ప్ర ధాన మంత్రి ఇందిరా గాంధీ అన్ని పౌరులకు సమాన హక్కుల ఆధారంగా రద్దు చేయబడాలని, ప్రభుత్వ ఆదాయ లోటును తగ్గించాల్సిన అవసరాన్ని వాదించారు.	45.0	en	telugu
Functions can be added through add-ons created by third-party developers.	మూడవ పార్టీ డెవలపర్లు సృష్టించిన యాడ్-ఆన్ల ద్వారా ఫంక్షన్లను జోడించవచ్చు.	70.0	en	telugu
In the fullest account in the Bibliotheca of Pseudo-Apollodorus, Heracles had to go to the island of Erytheia in the far west (sometimes identified with the Hesperides, or with the island which forms the city of Cádiz) to get the cattle.	సాయుడు-అపోలోడోర్స్ యొక్క లైబ్రూటెక్స్లో ఉన్న పూర్తి వివరణలో, హెరాక్లెస్ పశ్చిమంలో ఎరిథియా ద్వీపానికి (కొన్నిసార్లు హెస్పరీడ్స్తో లేదా కాడిజ్ నగరాన్ని ఏర్పరుస్తున్న ద్వీపంతో గుర్తించబడ్డాడు) పశువులను పొందడానికి వెళ్ళవలసి వచ్చింది.	80.0	en	telugu
Production of calcium carbide in China has been increasing.	చైనాలో కాల్షియం కార్బైడ్ ఉత్పత్తి పెరుగుతూనే ఉంది.	90.0	en	telugu
Several traditional indigenous sports remain fairly popular, such as kabaddi, kho kho, pehlwani and gilli-danda.	కబడ్డీ, కో కో, పెహ్ల్వానీ, గిల్లి డాండా వంటి అనేక సాంప్రదాయ స్థానిక క్రీడలు ఇప్పటికీ బాగా ప్రాచుర్యం పొందాయి.	80.0	en	telugu
North Korea's most famous restaurant, Okryu-gwan, located in Pyongyang, is known for its raengmyeon cold noodles.	ఉత్తర కొరియా యొక్క అత్యంత ప్రసిద్ధ రెస్టారెంట్, ఓక్రు-గ్వాన్, పియోంగ్యాంగ్లో ఉంది, దాని రాంగ్మీన్ చల్లని నూడుల్స్ కోసం ప్రసిద్ది చెందింది.	76.6666666666667	en	telugu
"""Theoretically, the HPV DNA and RNA tests could be used to identify HPV infections in cells taken from any part of the body."	"""సాహిత్యపరంగా, శరీరంలోని ఏ భాగంలోనైనా తీసుకున్న కణాలలో HPV సంక్రమణలను గుర్తించడానికి HPV DNA మరియు RNA పరీక్షలను ఉపయోగించవచ్చు."	66.6666666666667	en	telugu
S. S. Rajamouli choreographed the action sequences of the film.	ఎస్. ఎస్. రాజమౌలీ ఈ సినిమా యాక్షన్ సీక్వెన్స్ ను నిర్మాతగా చిత్రీకరించారు.	61.6666666666667	en	telugu
Realising the prowess of those high-souled princes, the sons of Vitahavya, King Divodasa, endued with great energy, rebuilt and fortified the city of Baranasi (Varanasi or Banaras) at Indra's command.	ఆ గొప్ప ఆత్మగల యువరాజుల శక్తిని గ్రహించిన వితావ్యా కుమారుడు రాజైన డివోడాసా, గొప్ప శక్తితో నిండిన ఇంద్రుని ఆదేశం మేరకు బారణాసి నగరాన్ని (వారణాసి లేదా బనారస్) పునర్నిర్మించి, బలపరిచారు.	65.0	en	telugu
"Godse claimed that Gandhi never really said ""Hey Ram"" as he was dying and this was just a ploy of the government to prove that he was, indeed, a staunch Hindu who deserved to be elevated to sainthood."	"గాంధీ చనిపోతున్నప్పుడు ""హే రామ్"" అని ఎప్పుడూ చెప్పలేదని, ఇది నిజంగానే అతను ఒక నమ్మకమైన హిందూ అని రుజువు చేయడానికి ప్రభుత్వం చేసిన ఒక కుట్ర అని గాడ్సే పేర్కొన్నారు."	71.3333333333333	en	telugu
Hyder paid 35 lakhs rupees in tribute to end the war, and returned most of his gains, although he did retain Sira.	యుద్ధాన్ని అంతం చేయడానికి హైడర్ 35 లక్షల రూపాయలు చెల్లించాడు, మరియు అతను సిరాను కలిగి ఉన్నప్పటికీ, తన లాభాలలో ఎక్కువ భాగాన్ని తిరిగి ఇచ్చాడు.	73.3333333333333	en	telugu
Bhopal became the new capital of the state, and Ravishankar Shukla was elected as the first Chief Minister.	భోపాల్ రాష్ట్రానికి కొత్త రాజధానిగా మారింది, మరియు రవిశంకర్ షుక్లా మొదటి ముఖ్యమంత్రిగా ఎన్నికయ్యారు.	60.0	en	telugu
According to the government, the defendants would be charged with crimes against humanity, genocide, murder, rape and arson.	ప్రభుత్వం ప్రకారం, మానవతా విరోధ నేరాలకు, జాతి హత్యలకు, హత్యలకు, అత్యాచారాలకు, అగ్నిమాపక చర్యలకు దోషిగా నిందిస్తారు.	75.0	en	telugu
"Some of Karky's most popular songs include ""Irumbile oru Irudhaiyam"" (Enthiran), ""Enamo Edho"" (Ko), ""Nee Koorinal"" (Nootrenbadhu), ""Asku Laska"" (Nanban), ""Google Google"" (Thuppakki), ""Elay Keechaan"" (Kadal), ""Osakka"" (Vanakkam Chennai), ""Selfie Pulla"" (Kaththi), ""Pookkalae Sattru Oyivedungal"" (I), ""Mei Nigara"" (24), ""Azhagiye"" (Kaatru Veliyidai), ""Endhira Logathu Sundariye"" (2.0) and ""Kurumba"" (Tik Tik Tik)."	"కర్కీ యొక్క అత్యంత ప్రాచుర్యం పొందిన పాటలలో ""ఇరుంబిలే ఓరు ఇరుధైయం"" (ఎంతిరాన్), ""ఎనామో ఎదో"" (కో), ""నీ కొరినాల్"" (నూత్రెన్బాద్), ""అస్కు లాస్కా"" (నాన్బన్), ""గూగుల్ గూగుల్"" (తుపాకీ), ""ఎలై కీచాన్"" (కడల్), ""ఒసాకా"" (వనాకామ్ చెన్నై), ""సెల్ఫీ పుల్ల"" (కథి), ""పుక్కాలాయ్ సతృ ఒయివెదుంగల్"" (ఐ), ""మే నిగారా"" (24), ""అజగీ"" (కట్రూ వెలియైడి), ""హైరా లోగథు సుందరియ"" (2. ఎండ్0) మరియు ""కురుంబు"" (టిక్ టి"	89.3333333333333	en	telugu
It stars Nandamuri Harikrishna, Jagapathi Babu, Venkat, Sivaji, Monica and music composed by S. A. Rajkumar.	నందమురి హరికృష్ణ, జగపతి బాబు, వెంకట్, శివాజీ, మోనికా నటించారు. సంగీతం ఎస్. ఎ. రాజకుమార్ రాశారు.	70.0	en	telugu
Later in Tipu sultan's time an alleged insurrection to overthrow Tipu and re establish the hindu king was plotted around 1783.	తరువాత టిప్పు సుల్తాన్ కాలంలో టిప్పును పడగొట్టడానికి మరియు హిందూ రాజును తిరిగి స్థాపించడానికి 1783లో తిరుగుబాటు జరిగింది.	80.0	en	telugu
Knowing this, Jagapati confronts Prasad.	ఈ విషయం తెలుసుకున్న జగపతి ప్రసాద్తో భేటీ అయ్యారు.	71.6666666666667	en	telugu
He also advises Rajeev to construct a temple to Ganesh and says if not built, it will be a bad omen for them.	గణేష్ కు ఆలయం నిర్మించాలని రాజీవ్ కి సలహా ఇస్తూ, అది నిర్మించకపోతే అది వారికి చెడు సంకేతం అని చెప్పారు.	80.0	en	telugu
In Test cricket, only two players i.e., Garfield Sobers and Jacques Kallis, have batting averages that are 20 greater than their bowling averages over their entire careers.	టెస్ట్ క్రికెట్లో కేవలం ఇద్దరు ఆటగాళ్లు గార్ఫీల్డ్ సోబెర్స్, జాక్ కాలిస్ మాత్రమే తమ కెరీర్ మొత్తంలో బౌలింగ్ సగటు కంటే 20 ఎక్కువ బ్యాటింగ్ సగటులను కలిగి ఉన్నారు.	45.0	en	telugu
Baran, is a city in Baran district of the Indian state of Rajasthan.	బారాన్, భారతదేశ రాజస్థాన్ రాష్ట్రంలోని బారాన్ జిల్లాలోని ఒక నగరం.	90.0	en	telugu
Lithuania has a flat tax rate rather than a progressive scheme.	లిథువేనియాలో ఒక క్రమబద్ధమైన పన్ను రేటు కంటే ఒక ఫ్లాష్ పన్ను రేటు ఉంది.	85.0	en	telugu
De Morgan arranged for the book to be republished in London under his own supervision.	డి మోర్గాన్ తన సొంత పర్యవేక్షణలో ఈ పుస్తకాన్ని లండన్లో పునః ప్రచురించాలని ఏర్పాట్లు చేశాడు.	86.6666666666667	en	telugu
Sir Seewoosagur Ramgoolam became the first prime minister of an independent Mauritius with Queen Elizabeth II remaining head of state as Queen of Mauritius.	సెయివ్వోసాగూర్ రామ్గులామ్ స్వతంత్ర మౌరిషియస్ యొక్క మొదటి ప్రధాన మంత్రిగా మారారు. మౌరిషియస్ రాణి ఎలిజబెత్ II మౌరిషియస్ రాణిగా రాష్ట్ర అధిపతిగా కొనసాగారు.	70.0	en	telugu
Puadh (IAST: [puādha], sometimes anglicized as Poadh or Powadh) is a historic region in north India that comprises parts of present-day Punjab, Haryana, Uttar Pradesh, Himachal Pradesh and the U.T.	పుధ్ (IAST: [puādha], కొన్నిసార్లు Poadh లేదా Powadh గా ఆంగ్లీకరించబడింది) ఉత్తర భారతదేశంలో ఒక చారిత్రక ప్రాంతం, ఇది ప్రస్తుత పంజాబ్, హర్యానా, ఉత్తర ప్రదేశ్, హిమాచల్ ప్రదేశ్ మరియు యుటి యొక్క భాగాలను కలిగి ఉంది.	94.6666666666667	en	telugu
The District Magistrate is assisted by one Additional District Magistrate and Ten Executive Magistrates with respect to enforcement of law and order.	చట్టాన్ని అమలు చేయడానికి జిల్లా మజిస్ట్రేట్కు ఒక అదనపు జిల్లా మజిస్ట్రేట్ మరియు పది ఎగ్జిక్యూటివ్ మజిస్ట్రేట్ సహాయపడతారు.	85.0	en	telugu
Mass civil disobedience spread throughout India as millions broke the salt laws by making salt or buying illegal salt.	ఉప్పు తయారీ లేదా చట్టవిరుద్ధమైన ఉప్పు కొనుగోలు చేయడం ద్వారా మిలియన్ల మంది ఉప్పు చట్టాలను ఉల్లంఘించినప్పుడు భారతదేశం అంతటా సామూహిక పౌర తిరుగుబాటు వ్యాపించింది.	80.0	en	telugu
Before him a parliamentary commission introduced the Armenian dram.	ఆయన ముందు ఒక పార్లమెంటరీ కమిషన్ అర్మేనియన్ డ్రామ్ను ప్రవేశపెట్టింది.	80.0	en	telugu
He also invented the first rotating anode X-ray tube.	అతను కూడా మొదటి తిరిగే అనోడ్ X- రే రే గొట్టం కనుగొన్నారు.	71.6666666666667	en	telugu
By contrast, in a substitution cipher, the units of the plaintext are retained in the same sequence in the ciphertext, but the units themselves are altered.	దీనికి విరుద్ధంగా, ఒక భర్తీ సంకేతంలో, సాధారణ టెక్స్ట్ యొక్క యూనిట్లు సంకేతపదంలో అదే క్రమంలో ఉంటాయి, కానీ యూనిట్లు కూడా మార్చబడతాయి.	80.0	en	telugu
By this time, villagers had domesticated numerous crops, including peas, sesame seeds, dates, and cotton, as well as animals, including the water buffalo.	ఈ సమయానికి, గ్రామస్తులు పుచ్చకాయలు, ససేమ్ విత్తనాలు, తాటిలు, పత్తి, అలాగే నీటి బుఫెల్ సహా జంతువులను అనేక పంటలను పెంపుడు జంతువులుగా చేశారు.	38.3333333333333	en	telugu
Iceland's largest geothermal power plants are Hellisheiði and Nesjavellir, while Kárahnjúkar Hydropower Plant is the country's largest hydroelectric power station.	ఐస్లాండ్ యొక్క అతిపెద్ద భూఉష్ణ విద్యుత్ కేంద్రాలు హెల్షిషైడి మరియు నెస్జావెల్లిర్, అయితే కారాహన్జుకర్ హైడ్రోపవర్ ప్లాంట్ దేశం యొక్క అతిపెద్ద జలవిద్యుత్ ప్లాంట్.	70.0	en	telugu
The Lepcha are largely an endogamous community.	లెప్చాలు ఎక్కువగా ఇండోగామిక్ సమాజం.	80.0	en	telugu
The Mosquito Coast remained an autonomous area until 1894.	మస్కీటో కోస్ట్ 1894 వరకు స్వయంప్రతిపత్తి కలిగిన ప్రాంతంగా మిగిలిపోయింది.	80.0	en	telugu
"She has received many national and international accolades including the ""Yuva Ojaswini Award"", an Indian national level award, and the Young Achievers Award by American Consulate."	"ఆమె ""యూవా ఒజాస్విని అవార్డు"" సహా అనేక జాతీయ మరియు అంతర్జాతీయ అవార్డులను అందుకుంది, ఇది భారతీయ జాతీయ స్థాయి అవార్డు, మరియు అమెరికన్ కాన్సులేట్ ద్వారా యంగ్ అచీవర్స్ అవార్డు."	60.0	en	telugu
The size of this complex is debated (from 100 to 300 acres).	ఈ సముదాయం యొక్క పరిమాణం గురించి చర్చ జరుగుతోంది (100 నుండి 300 ఎకరాల వరకు).	80.0	en	telugu
Lavoisier drafted their defense, refuting the financial accusations, reminding the court of how they had maintained a consistently high quality of tobacco.	లావోయిజర్ వారి రక్షణను రూపొందించారు, ఆర్థిక ఆరోపణలను తిరస్కరించారు, వారు ధూమపానం యొక్క స్థిరమైన అధిక నాణ్యతను ఎలా నిర్వహించారో కోర్టును గుర్తు చేశారు.	80.0	en	telugu
