original	translation	mean	source_lang	target_lang
Balabhadrapuram is an Indian Railways station in Balabhadrapuram, a village in East Godavari district of Andhra Pradesh.	బాలభద్రపురం అనేది ఆంధ్రప్రదేశ్ రాష్ట్రంలోని తూర్పు గోదావరి జిల్లాలోని బాలభద్రపురం అనే గ్రామంలో ఉన్న భారతీయ రైల్వే స్టేషన్.	95.0	en	telugu
A total of 1,454 engines had been built by 1800.	1800 నాటికి మొత్తం 1,454 ఇంజిన్లు నిర్మించబడ్డాయి.	80.0	en	telugu
He practiced as a lawyer in Warangal district till 1998.	1998 వరకు వారంగల్ జిల్లాలో న్యాయవాదిగా పనిచేశారు.	80.0	en	telugu
Another study detected HPV in the EBC, bronchial brushing and neoplastic lung tissue of cases, and found a presence of an HPV infection in 16.4% of the subjects affected by nonsmall cell lung cancer, but in none of the controls.	మరొక అధ్యయనంలో EBC లో HPV, బ్రోంకియల్ బ్రషింగ్ మరియు న్యూప్లాస్టిక్ ఊపిరితిత్తుల కణజాలం కేసులలో గుర్తించబడ్డాయి మరియు చిన్న సెల్ ఊపిరితిత్తుల క్యాన్సర్తో బాధపడుతున్న 16.4% మందిలో HPV సంక్రమణ ఉనికిని కనుగొనబడింది, కానీ నియంత్రణలో ఏదీ లేదు.	83.3333333333333	en	telugu
Many intellectuals, labour unions, artists and political parties worldwide have been influenced by Marx's work, with many modifying or adapting his ideas.	ప్రపంచవ్యాప్తంగా ఉన్న అనేక మంది మేధావులు, కార్మిక సంఘాలు, కళాకారులు మరియు రాజకీయ పార్టీలు మార్క్స్ యొక్క పని ద్వారా ప్రభావితమయ్యాయి, చాలామంది అతని ఆలోచనలను సవరించారు లేదా అనుగుణంగా మార్చారు.	90.0	en	telugu
As per the tradition, while the basic plot has taken elements from the sources such as the Samvada Sukta of the Rigveda (ऋग्वेद), Mahabharata and others, Kalidasa has made significant adaptations to make the presentation more appealing while establishing his prowess as a playwright (नाटककार).	సంప్రదాయం ప్రకారం, రిగ్వేదంలోని సామ్వాద సుక్త, మహాభారతం మొదలైన మూలాల నుండి ప్రాథమిక కథనాన్ని తీసుకొన్నప్పటికీ, నాటక రచయితగా తన నైపుణ్యాన్ని స్థాపించేటప్పుడు ప్రదర్శనను మరింత ఆకర్షణీయంగా చేయడానికి కాలిదాసా గణనీయమైన అనుసరణలను చేశాడు.	71.6666666666667	en	telugu
From then on a large number of Buddhist statues were discovered in the Peshawar valley.	అప్పటి నుండి పెషవార్ లోయలో పెద్ద సంఖ్యలో బౌద్ధ విగ్రహాలు కనుగొనబడ్డాయి.	90.0	en	telugu
After two tense months of daily and disruptive protesting, the relief camp strikers decided to take their grievances to the federal government and embarked on the On-to-Ottawa Trek, but their protest was put down by force.	రెండు నెలల ఉద్రిక్తతతో రోజువారీ మరియు విచ్ఛిన్నమైన నిరసనల తరువాత, సహాయ శిబిరంలో సమ్మె చేసేవారు తమ ఫిర్యాదులను సమాఖ్య ప్రభుత్వానికి తీసుకురావాలని నిర్ణయించుకున్నారు మరియు ఆన్-టు-ఓటావా ట్రెక్లో పాల్గొన్నారు, కానీ వారి నిరసన బలవంతంగా అణిచివేయబడింది.	70.0	en	telugu
Senior high schools are also provided with all their textbook requirement by the government.	ఉన్నత పాఠశాలలకు కూడా ప్రభుత్వానికి పాఠ్యపుస్తకాల అవసరాలు ఉంటాయి.	80.0	en	telugu
The main rivers and estuaries are the Thames, Severn and the Humber.	ప్రధాన నదులు మరియు మౌన నదులు థామ్స్, సెవర్న్ మరియు హంబర్.	63.3333333333333	en	telugu
It can also be used in the preparation of calcium cyanide and melamine.	ఇది కాల్షియం సైయాన్యిడ్ మరియు మెలమిన్ తయారీలో కూడా ఉపయోగించవచ్చు.	100.0	en	telugu
China National Highway 219 runs through Aksai Chin connecting Lhatse County (Lhazê, Lazi) and Xinjiang in the Tibet Autonomous Region.	చైనా జాతీయ రహదారి 219 అక్సాయ్ చిన్ గుండా నడుస్తుంది, ఇది టిబెట్ స్వయంప్రతిపత్తి ప్రాంతంలోని లాజే, లాజి మరియు జిన్జియాంగ్లను కలుపుతుంది.	70.0	en	telugu
In spinal TB, surgery is indicated for spinal instability (when there is extensive bony destruction) or when the spinal cord is threatened.	వెన్నెముక కణితిలో, వెన్నెముక అస్థిరత (అతిశ్రేణి ఎముక నాశనం ఉన్నప్పుడు) లేదా వెన్నెముక మెడకు ముప్పు ఉన్నప్పుడు శస్త్రచికిత్స సూచించబడుతుంది.	78.3333333333333	en	telugu
However, deputy mayors are always elected by the local council, of which one is (or, in certain local authorities two are) the Designated Acting Mayor, elected after nomination by the Mayor.	అయితే, ఉప మేయర్లను ఎల్లప్పుడూ స్థానిక మండలి ఎన్నుకుంటుంది, వీరిలో ఒకరు (లేదా కొన్ని స్థానిక సంస్థలలో ఇద్దరు) మేయర్ నామినేషన్ తర్వాత ఎన్నికైన నియమించబడిన నియామక మేయర్.	70.0	en	telugu
Later, he was a member of the Academic Council, chairman of the arts faculty, member of the Andhra University Senate, and member of the Syndicate.	తరువాత, అతను అకాడెమిక్ కౌన్సిల్ సభ్యుడు, ఆర్ట్స్ ఫ్యాకల్టీ ఛైర్మన్, ఆంధ్ర విశ్వవిద్యాలయ సెనేట్ సభ్యుడు మరియు సిండికేట్ సభ్యుడు.	80.0	en	telugu
Jewish merchants from the Hormuz brought their Indian textile and fruit to the Somali coast in exchange for grain and wood.	హార్ముజ్ నుండి వచ్చిన యూదు వ్యాపారులు తమ భారతీయ వస్త్రాలు, పండ్లను సోమాలియా తీరానికి తీసుకువచ్చారు.	58.3333333333333	en	telugu
Public sex is sexual activity that takes place in a public context.	బహిరంగ సెక్స్ అనేది బహిరంగ సందర్భంలో జరిగే లైంగిక చర్య.	90.0	en	telugu
Raja arrives and beats up all of his goons.	రాజా వస్తాడు మరియు తన కుర్రాళ్ళందరినీ కొట్టాడు.	46.6666666666667	en	telugu
The term SSHD is a more precise term than the more general hybrid drive, which has previously been used to describe SSHD devices and non-integrated combinations of solid-state drives (SSDs) and hard disk drives.	SSHD అనే పదం సాధారణ హైబ్రిడ్ డ్రైవ్ కంటే మరింత ఖచ్చితమైన పదం, ఇది SSHD పరికరాలను మరియు ఘన-స్థితి డ్రైవ్లు (SSD లు) మరియు హార్డ్ డిస్క్ డ్రైవ్ల యొక్క సమగ్రమైన కలయికలను వివరించడానికి గతంలో ఉపయోగించబడింది.	75.0	en	telugu
The film was produced by Dil Raju's Sri Venkateswara Creations.	ఈ సినిమాను దిల్ రాజు శ్రీ వెంకటేశ్వర క్రియేషన్స్ నిర్మిస్తోంది.	90.0	en	telugu
Sudarshan Rao agrees for the marriage of Suryam and Surekha.	సురమ్, సురేఖ పెళ్లికి సుధర్షన్ రావు అంగీకరిస్తున్నారు.	70.0	en	telugu
He appointed government officials to represent various ethnic groups.	ఆయన వివిధ జాతుల ప్రతినిధులను ప్రభుత్వ అధికారులను నియమించారు.	80.0	en	telugu
The ferries transport vehicles as well as passengers.	పడవలు వాహనాలు, ప్రయాణీకులను రవాణా చేస్తాయి.	90.0	en	telugu
A planet that can sustain life is termed habitable, even if life did not originate there.	జీవానికి ప్రాణం పోసే గ్రహం అంటే ఆ గ్రహం నుండి జీవనం రాకపోయినా అది నివాసస్థలం అని చెప్పవచ్చు.	30.0	en	telugu
The entire story revolves a forest where the protection of a tribe against a tiger and deadly gangsters by a forest officer Chaitanya (Akkineni Nagarjuna).	ఈ కథ మొత్తం ఒక అడవి చుట్టూ తిరుగుతుంది, ఇక్కడ ఒక అడవి అధికారి చైతన్య (అక్కినేని నాగార్జునా) ఒక తెగను పులి మరియు ప్రాణాంతక ముఠా వ్యతిరేకంగా రక్షించారు.	75.0	en	telugu
Salts and esters of caproic acid are known as caproates or hexanoates.	కాప్రోయిక్ యాసిడ్ యొక్క ఉప్పులు మరియు ఎస్టర్లను కాప్రోయిట్స్ లేదా హెక్సానోయిట్స్ అని పిలుస్తారు.	80.0	en	telugu
Armed police were dispatched to control the situation while the crowd marched towards the market and started shouting anti-government slogans.	పరిస్థితిని నియంత్రించడానికి సాయుధ పోలీసులను పంపించారు. ప్రజలు మార్కెట్ వైపు తిరుగుతూ ప్రభుత్వ వ్యతిరేక నినాదాలు వినిపించారు.	70.0	en	telugu
In hand-to-hand fighting, he killed three enemy soldiers.	చేతితో చేతితో పోరాటంలో, అతను మూడు శత్రువు సైనికులను చంపాడు.	60.0	en	telugu
Voting rights for Reang refugees are under threat, as the Mizo NGOs have constantly opposed their participation in the election process.	ఎన్నికల ప్రక్రియలో వారి భాగస్వామ్యాన్ని మిజో ఎన్జిఒలు నిరంతరం వ్యతిరేకిస్తున్నందున రీంగ్ శరణార్థుల ఓటు హక్కులు బెదిరింపులో ఉన్నాయి.	70.0	en	telugu
It was followed by an appearance in the song Nuvvu ready in the Telugu movie King opposite Nagarjuna.	తరువాత నగర్జునాతో పాటు తెలుగు సినిమా కింగ్ లో నవ్వు రెడీ అనే పాటలో కనిపించారు.	86.6666666666667	en	telugu
Tilak was backed by rising public leaders like Bipin Chandra Pal and Lala Lajpat Rai, who held the same point of view.	టిలక్కు బిపిన్ చంద్రపాల్, లాలా లజపత్ రాయ్ వంటి పెరుగుతున్న ప్రజా నాయకులు మద్దతు ఇచ్చారు.	70.0	en	telugu
"However, academics Hilary Footitt and Michael Kelly note the Dayton Agreement states it is ""done in Bosnian, Croatian, English and Serbian"", and they describe this as the ""de facto recognition of three official languages"" at the state level."	"అయితే, విద్యావేత్తలు హిల్లరీ ఫౌటిట్ మరియు మైఖేల్ కెల్లీ డేటన్ ఒప్పందం ""బోస్నియన్, క్రొయేషియన్, ఇంగ్లీష్ మరియు సెర్బియన్ భాషలలో జరుగుతుంది"" అని పేర్కొన్నారు మరియు దీనిని రాష్ట్ర స్థాయిలో ""మూడు అధికారిక భాషల వాస్తవ గుర్తింపు"" అని వారు వర్ణించారు."	60.0	en	telugu
The song Thudikkum Vaalibame sung by R. Balasaraswathi Devi in this film was a big hit.	ఈ చిత్రంలో ఆర్. బాలసారస్వతి దేవి పాడిన 'ధుదిక్ కుం వాలిబమే' పాట పెద్ద హిట్ గా నిలిచింది.	90.0	en	telugu
Janjgir is the headquarters of the Janjgir–Champa district in Chhattisgarh, India.	జంజిగర్ భారతదేశంలోని ఛత్తీస్గఢ్ లోని జంజిగర్ఛాంపా జిల్లా ప్రధాన కార్యాలయం.	60.0	en	telugu
The village institutions of South India, of course, date from a much earlier period than that of Parantaka I, but he introduced many salutary reforms for the proper administration of local self-Government.	దక్షిణ భారతదేశంలోని గ్రామీణ సంస్థలు పరాంతక I కన్నా చాలా మునుపటి కాలం నాటివి. అయితే స్థానిక స్వయంప్రతిపత్తిని సరైన పరిపాలన కోసం ఆయన అనేక సంస్కరణలను ప్రవేశపెట్టారు.	66.6666666666667	en	telugu
In the Jammu region, the forces besieged in Poonch broke out and temporarily linked up with the outside world again.	జమ్మూ ప్రాంతంలో, పూంచ్ లో ముట్టడిపడ్డ దళాలు విరిగి, తాత్కాలికంగా బయటి ప్రపంచంతో తిరిగి అనుసంధానించబడ్డాయి.	70.0	en	telugu
Jangareddygudem (JRG) is a town in West Godavari district of the Indian state of Andhra Pradesh.	జంగరేడ్డిగుడెమ్ (JRG) అనేది భారత రాష్ట్రం ఆంధ్రప్రదేశ్ లోని పశ్చిమ గోదావరి జిల్లాలోని ఒక పట్టణం.	71.6666666666667	en	telugu
These are the uncreated existing constituents of the Universe which impart the necessary dynamics to the Universe by interacting with each other.	ఇవి విశ్వం యొక్క సృష్టికర్తలు కావు. ఇవి పరస్పరం పరస్పర చర్య ద్వారా విశ్వానికి అవసరమైన డైనమిక్ను అందిస్తాయి.	71.6666666666667	en	telugu
This can occur as a result of alcoholism, long-term diarrhea, carcinoid syndrome, Hartnup disease, and a number of medications such as isoniazid.	మద్యపాన, దీర్ఘకాలిక ప్రసారం, కార్సినోయిడ్ సిండ్రోమ్, హార్ట్నప్ వ్యాధి మరియు ఐసోనియాజిడ్ వంటి అనేక మందుల ఫలితంగా ఇది సంభవించవచ్చు.	80.0	en	telugu
Dietrich later remarked that she was at her most beautiful in The Devil Is a Woman.	తరువాత డైట్రిచ్ ఆమె ది డెవిల్ ఇస్ ఎ ఫెమ్మెన్ లో ఆమె అత్యంత అందమైనదని పేర్కొన్నారు.	58.0	en	telugu
Its capital is St. George's.	దీని రాజధాని సెయింట్ జార్జ్.	88.3333333333333	en	telugu
Anacyclus officinarum Hayne Sources: E+M, AFPD Anacyclus pyrethrum, the pellitory, Spanish chamomile, Mount Atlas daisy, or Akarkara, is a species of flowering plant in the daisy family Asteraceae.	Anacyclus officinarum హేన్ మూలంః E+M, AFPD Anacyclus pyrethrum, పెల్లిటోరి, స్పానిష్ కామోమిల్, మౌంట్ అట్లాస్ డేసీ, లేదా అకార్కారా, డాసీ కుటుంబంలోని పుష్పించే మొక్కల జాతి అస్టెరాసీ.	76.6666666666667	en	telugu
The world population at this time has been estimated at about 27 million.	ఈ సమయంలో ప్రపంచ జనాభా సుమారు 27 మిలియన్లు అని అంచనా వేయబడింది.	61.6666666666667	en	telugu
The English language was used as the medium of instruction on the grounds that it was the key to Western knowledge.	పాశ్చాత్య జ్ఞానం కోసం ఆంగ్ల భాష కీలకం అని చెప్పడం ద్వారా ఆంగ్ల భాషను బోధన సాధనంగా ఉపయోగించారు.	80.0	en	telugu
Ravi also likes her but he doesn't express it to her.	రవి కూడా ఆమెను ఇష్టపడుతున్నాడు కానీ అతను దానిని ఆమెతో వ్యక్తం చేయడు.	70.0	en	telugu
The senior Narasimha was crowned Emperor and became known as Saluva Narasimha Deva Raya.	సీనియర్ నారాసింహాను చక్రవర్తిగా కిరీటం చేశారు మరియు సల్వా నారాసింహా దేవరాయ అని పిలుస్తారు.	70.0	en	telugu
[citation needed] Majumdar started his research on ancient India.	[అనువాదం అవసరం] మజుమదార్ తన పరిశోధనలను ప్రాచీన భారతదేశం మీద ప్రారంభించాడు.	63.3333333333333	en	telugu
One of his queens, Chandala Devi, a princess from the Shilahara ruling family of Karad was called Abhinava Saraswati for her skills as an artist.	కరాడ్ రాజవంశం నుంచి వచ్చిన చందల దేవి అనే యువరాణిని ఆమె కళాకారుడిగా నైపుణ్యం కలిగినందుకు అభినావా సారాస్వతి అని పిలిచేవారు.	66.6666666666667	en	telugu
Penukonda Junction (station code: PKD) is the primary railway station serving Penukonda in Andhra Pradesh, India.	పెనుకొండ జంక్షన్ (స్టేషన్ కోడ్ః PKD) భారతదేశంలోని ఆంధ్రప్రదేశ్ రాష్ట్రంలోని పెనుకొండకు సేవలు అందించే ప్రధాన రైల్వే స్టేషన్.	95.0	en	telugu
Employers could pay a child less than an adult even though their productivity was comparable; there was no need for strength to operate an industrial machine, and since the industrial system was completely new, there were no experienced adult labourers.	ఒక పారిశ్రామిక యంత్రాన్ని నిర్వహించడానికి శక్తులు అవసరం లేదు, మరియు పారిశ్రామిక వ్యవస్థ పూర్తిగా కొత్తది కాబట్టి, అనుభవజ్ఞులైన పెద్దల కార్మికులు లేరు.	70.0	en	telugu
During this time much of the local nobility was created.	ఈ కాలంలో స్థానిక ప్రభువుల సంఖ్యలో ఎక్కువ భాగం ఏర్పడింది.	88.3333333333333	en	telugu
He bathed her vigorously by the holy waters of the Ganga emanating from his matted hair.	తన జుట్టులో నుండి ప్రవహించే గంగానది పవిత్ర జలాల ద్వారా ఆయన ఆమెను బలంగా స్నానం చేశాడు.	70.0	en	telugu
The tertiary education sector includes universities and other technical institutions in Mauritius.	ఉన్నత విద్యా రంగం లో మౌరిషియస్ లోని విశ్వవిద్యాలయాలు మరియు ఇతర సాంకేతిక సంస్థలు ఉన్నాయి.	90.0	en	telugu
The Japanese eventually drove the last of the Australian and Allied forces out.	చివరికి ఆస్ట్రేలియా మరియు మిత్రరాజ్యాల దళాలను జపాన్ తరిమివేసింది.	90.0	en	telugu
Akbar organised his army as well as the nobility by means of a system called the mansabdari.	అక్బర్ తన సైన్యాన్ని, నోబుల్ను మంబ్దారీ అని పిలిచే వ్యవస్థ ద్వారా నిర్వహించాడు.	60.0	en	telugu
The Mewat region where TJ started around Delhi was inhabited by the Meos, a Rajput ethnic group, some of whom had converted to Islam, and then re-converted to Hinduism when Muslim political power declined in the region, lacking the necessary acumen (according to one author, Ballard) required to resist the cultural and religious influence of majority Hindus, prior to the arrival of Tablighi Jamaat.	ఢిల్లీ చుట్టూ టిజె ప్రారంభమైన మెవాట్ ప్రాంతంలో మౌస్, ఒక రాజపుత్ జాతి సమూహం నివసించారు, వీరిలో కొందరు ఇస్లాం మతం లోకి మార్చారు, తరువాత ముస్లిం రాజకీయ శక్తి ఈ ప్రాంతంలో క్షీణించినప్పుడు హిందూమతంలోకి తిరిగి మార్చారు, తబ్లిఘి జమాత్ రాక ముందు, హిందువుల మెజారిటీ యొక్క సాంస్కృతిక మరియు మతపరమైన ప్రభావానికి వ్యతిరేకంగా అవసరమైన అవగాహన (ఒక రచయిత ప్రకారం, బల్లార్డ్) లేకపోవడం.	68.3333333333333	en	telugu
Represented India for more than 75 Times .	75 సార్లు భారతదేశాన్ని ప్రతినిధులుగా చేశారు.	90.0	en	telugu
Compressing the air increases its pressure and temperature.	గాలిని కుదించడం దాని ఒత్తిడిని మరియు ఉష్ణోగ్రతను పెంచుతుంది.	73.3333333333333	en	telugu
Srirangarajapuram is a village in Chittoor district of the Indian state of Andhra Pradesh.	శ్రీరాంగరాజపురం అనేది భారత రాష్ట్రమైన ఆంధ్రప్రదేశ్ లోని చిట్టూర్ జిల్లాలోని ఒక గ్రామం.	65.0	en	telugu
The result is one of the various types of compact star.	ఫలితంగా వివిధ రకాల కాంపాక్ట్ స్టార్లలో ఒకటి.	58.3333333333333	en	telugu
