original	translation	mean	source_lang	target_lang
The former joins at Rundh and the latter at Vyas in Vadodara district of Gujarat, opposite each other and form a Triveni (confluence of three rivers) on the Narmada.	మునుపటిది గుజరాత్ లోని వాడోదరా జిల్లాలోని రంద్ వద్ద మరియు రెండోది వియాస్ వద్ద కలుస్తుంది, ఇది ప్రతి ఇతర వ్యతిరేకంగా ఉంటుంది మరియు నర్మడపై త్రివేని (మూడు నదుల సమావేశం) ను ఏర్పరుస్తుంది.	70.0	en	telugu
Lukashenko continued a number of Soviet-era policies, such as state ownership of large sections of the economy.	ఆర్థిక వ్యవస్థలో పెద్ద భాగాలను రాష్ట్ర యాజమాన్యం వంటి సోవియట్ యుగంలోని అనేక విధానాలను లూకాషెంకో కొనసాగించాడు.	75.0	en	telugu
The average annual temperature is 24.9 °C (76.8 °F).	సగటు వార్షిక ఉష్ణోగ్రత 24.9 °C (76.8 °F).	88.3333333333333	en	telugu
Most lenses are spherical lenses: their two surfaces are parts of the surfaces of spheres.	చాలా లెన్స్లు గోళాకార లెన్స్లుః వాటి రెండు ఉపరితలాలు గోళాల ఉపరితల భాగాలు.	90.0	en	telugu
Transport in Cameroon is often difficult.	కామెరూన్లో రవాణా తరచుగా కష్టం.	90.0	en	telugu
Ketones are converted to 1,1-diiodoalkenes upon treatment with triphenylphosphine (PPh3) and carbon tetraiodide.	ట్రిఫెనిల్ఫోస్ఫిన్ (PPh3) మరియు కార్బన్ టెట్రాయోడైడ్తో చికిత్స చేసినప్పుడు కెటోన్లు 1,1-డియోడాల్కెన్లుగా మార్చబడతాయి.	78.3333333333333	en	telugu
Neemuch district is part of the Ujjain Division.	నీముచ్ జిల్లా ఉజ్జయ్న్ విభాగంలో భాగం.	91.6666666666667	en	telugu
Other urban Christian expatriate communities from Europe and West Africa are also present.	యూరప్, పశ్చిమ ఆఫ్రికా నుండి ఇతర పట్టణ క్రైస్తవ బహిష్కృతుల సంఘాలు కూడా ఉన్నాయి.	80.0	en	telugu
Although Jedidiah Morse did not change Samuel's political views, he continued as an influence.	జెడిడియా మోర్సే శామ్యూల్ యొక్క రాజకీయ అభిప్రాయాలను మార్చలేదు, కానీ అతను ఒక ప్రభావంగా కొనసాగాడు.	70.0	en	telugu
However, a review of randomized controlled trials concluded that the use of corrective glasses to prevent strabismus is not supported by existing research.	అయితే, రాండమైజ్డ్ కంట్రోల్డ్ ట్రయల్స్ సమీక్షలో, స్ట్రాబిస్మస్ ని నివారించడానికి సరిదిద్దే గాజుల వాడకం ఇప్పటికే ఉన్న పరిశోధనల ద్వారా మద్దతు ఇవ్వబడదని తేలింది.	70.0	en	telugu
Ravi Varma marries Suchitra (Preeti), who is an ex-girlfriend of Raja.	రాజీ మాజీ స్నేహితురాలు అయిన సుచిత్రుని (ప్రీతి) తో రవి వర్మా వివాహం చేసుకున్నాడు.	60.0	en	telugu
Neknam Khan, who served in Abdullah's army, was the commander-in-chief of the Carnatic.	అబ్దుల్లా సైన్యంలో సేవలందించిన నెఖ్నామ్ ఖాన్, కార్నాటిక్ యొక్క ప్రధాన కమాండర్.	80.0	en	telugu
The ancient history of the island is unknown in either Hindu or Buddhist records.	ఈ ద్వీపం యొక్క పురాతన చరిత్ర హిందూ లేదా బౌద్ధ రికార్డులలో తెలియదు.	71.6666666666667	en	telugu
"Elísabet Jónsdóttir (""Elísabet, Jón's daughter"" (Jón, being the father)) or Ólafur Katrínarson (""Ólafur, Katrín's son"" (Katrín being the mother))."	"ఎలిసాబెత్ జోన్స్డోటిర్ (""ఎలిసాబెత్, జోన్ కుమార్తె"" (జోన్, తండ్రిగా) లేదా ఓలాఫూర్ కాట్రిన్ర్సన్ (""ఓలాఫూర్, కాట్రిన్ కుమారుడు"" (కట్రిన్ తల్లిగా))."	70.0	en	telugu
There are four industrial areas in the district.	జిల్లాలో నాలుగు పారిశ్రామిక ప్రాంతాలు ఉన్నాయి.	90.0	en	telugu
"Because of concerns such as dignity, human rights and political correctness, the term ""patient"" is not always used to refer to a person receiving health care."	"గౌరవం, మానవ హక్కులు, రాజకీయ సరియైనత వంటి ఆందోళనల కారణంగా, ""రోగి"" అనే పదాన్ని ఎల్లప్పుడూ ఆరోగ్య సంరక్షణను స్వీకరించే వ్యక్తిని సూచించడానికి ఉపయోగించరు."	80.0	en	telugu
Significant progress in all spheres of economic-socio-cultural life is noticeable after 2008.	2008 తర్వాత ఆర్థిక, సాంస్కృతిక జీవితంలోని అన్ని రంగాలలో గణనీయమైన పురోగతి గమనించవచ్చు.	85.0	en	telugu
G. K. (Mukesh Rishi) is an MP whose antisocial activities are contained by Ranjit.	జి. కె. (ముకేష్ రిషి) ఒక ఎంపీ. దీని సామాజిక వ్యతిరేక కార్యకలాపాలను రంజిత్ నిరోధించారు.	80.0	en	telugu
This festival is held at the lakefront Henry Maier Festival Park just south of downtown, as are a summer-long array of ethnic musical festivals.	ఈ పండుగ సరస్సు ఒడ్డున ఉన్న హెన్రీ మయిర్ ఫెస్టివల్ పార్క్లో నగర కేంద్రానికి దక్షిణాన జరుగుతుంది, అలాగే వేసవిలో అనేక జాతి సంగీత పండుగలు జరుగుతాయి.	85.0	en	telugu
Maganti Venkateswara Rao (Babu) is an Indian politician from Andhra Pradesh.	మగాంతీ వెంకటేశ్వర రావు (బాబు) ఆంధ్రప్రదేశ్కు చెందిన భారతీయ రాజకీయవేత్త.	70.0	en	telugu
"The Ardagh line was effectively a modification of the Johnson line, and became known as the ""Johnson-Ardagh Line""."	"ఆర్డాగ్ లైన్ జాన్సన్ లైన్ యొక్క ఒక మార్పుగా ఉంది, మరియు దీనిని ""జాన్సన్-ఆర్డాగ్ లైన్"" అని పిలుస్తారు."	80.0	en	telugu
It is one among 14 constituencies in the Anantapur district.	అనంతపుర జిల్లాలోని 14 నియోజకవర్గాల్లో ఇది ఒకటి.	90.0	en	telugu
Imam al-Mutawakkil Yahya chose his son Ali to succeed him, a decision that infuriated his other son al-Mutahhar ibn Yahya.	ఇమామ్ అల్-ముతావకిల్ యాహ్య తన కుమారుడు అలీని తన స్థానంలో ఎంచుకున్నాడు, ఇది అతని ఇతర కుమారుడు అల్-ముతాహర్ ఇబ్న్ యాహ్యాను కోపపరిచింది.	70.0	en	telugu
"Jal Mahal (meaning ""Water Palace"") is a palace in the middle of the Man Sagar Lake in Jaipur city, the capital of the state of Rajasthan, India."	"జల్ మహల్ (అంటే ""నీటి ప్యాలెస్"") అనేది భారతదేశంలోని రాజస్థాన్ రాష్ట్ర రాజధాని జైపూర్ నగరంలో మన్ సగర్ సరస్సు మధ్యలో ఉన్న ఒక ప్యాలెస్."	75.0	en	telugu
—Ashok Chakra citation For her bravery, the Government of India posthumously awarded Bhanot the Ashoka Chakra Award, India's highest gallantry award for bravery in the face of the enemy during peacetime.	అశోక్ చక్రం ప్రస్తావన ఆమె ధైర్యానికి భారత ప్రభుత్వం శాంతి సమయంలో శత్రువుల ఎదుట సాహసానికి భారతదేశ అత్యున్నత ధైర్య పురస్కారం అయిన అశోక్ చక్ర అవార్డును భానోట్ కు మరణానంతరం ప్రదానం చేసింది.	95.0	en	telugu
As no census exists, there are no official statistical data regarding the distribution or usage of Belgium's three official languages or their dialects.	జనాభా లెక్కలు లేనందున, బెల్జియం యొక్క మూడు అధికారిక భాషలు లేదా వాటి ఉపన్యాసాల పంపిణీ లేదా వాడకానికి సంబంధించి అధికారిక గణాంక డేటా లేదు.	73.3333333333333	en	telugu
Much of the national budget was devoted to military expenditure, leaving few resources for healthcare, among other services.	జాతీయ బడ్జెట్లో ఎక్కువ భాగం సైనిక వ్యయాలకు కేటాయించబడింది, ఇతర సేవలతో పాటు ఆరోగ్య సంరక్షణకు కూడా తక్కువ వనరులు మిగిలి ఉన్నాయి.	85.0	en	telugu
Another ferry route to Travemünde originates from Malmö.	ట్రావెమౌండ్కు మరో ఫెర్రీ మార్గం మాల్మో నుండి వస్తుంది.	68.3333333333333	en	telugu
Banawali, which is earlier called Vanavali, is on the left banks of dried up Sarasvati River.	గతంలో వనావాలీ అని పిలువబడే బనావాలీ ఎడమ ఒడ్డున ఉన్న ఎడమ నది సారాస్వతి నదిలో ఉంది.	88.3333333333333	en	telugu
These include the very eastern stretch of the Alps, Alpokalja, in the west of the country, the Transdanubian Mountains in the central region of Transdanubia, and the Mecsek Mountains and Villány Mountains in the south.	వీటిలో ఆల్ప్స్ యొక్క తూర్పు ప్రాంతం, దేశంలోని పశ్చిమ ప్రాంతంలో ఉన్న అల్పోకాలాజా, ట్రాన్స్డానిబియా పర్వతాలు, మధ్య ప్రాంతంలోని ట్రాన్స్డానిబియా మరియు దక్షిణ ప్రాంతంలో మెక్సెక్ పర్వతాలు మరియు విల్లాని పర్వతాలు ఉన్నాయి.	70.0	en	telugu
The primary roles of women are that of wife and mother, so childcare, house chores, meal preparation, and a discrete life is required of a Malian women.	మహిళల ప్రధాన పాత్రలు భార్య, తల్లి, కాబట్టి పిల్లలను చూసుకోవడం, ఇంటి పనులు, భోజనం సిద్ధం చేయడం, మరియు ఒక ప్రత్యేక జీవితం మాలియన్ మహిళల నుండి అవసరం.	90.0	en	telugu
All Nippon Airways, the largest airline in Japan, is JAL's main competitor.	జపాన్ లో అతిపెద్ద విమానయాన సంస్థ అయిన ఆల్ నిప్పన్ ఎయిర్వేస్ జేఎల్ కు ప్రధాన పోటీదారు.	70.0	en	telugu
In winter, Tawang frequently experiences heavy snowfall.	శీతాకాలంలో, తవాంగ్ తరచుగా భారీ మంచు వర్షాలు ఎదుర్కొంటుంది.	65.0	en	telugu
The defeated king also was invited to attend these sacrifice ceremonies, as a friend and ally.	ఓడిపోయిన రాజు కూడా ఈ త్యాగ వేడుకలకు హాజరయ్యేందుకు ఆహ్వానించబడ్డాడు, ఒక స్నేహితుడు మరియు మిత్రుడు.	56.6666666666667	en	telugu
Following the tussle over the enactment of the Hindu Code Bill, he took a more active role in state affairs.	హిందూ సంకేత బిల్లును అమలు చేసేందుకు జరిగిన పోరాటాల తరువాత, రాష్ట్ర వ్యవహారాల్లో ఆయన మరింత చురుకైన పాత్ర పోషించారు.	86.0	en	telugu
The Chennai Metropolitan Development Authority (CMDA) is the nodal agency that handles town planning and development within the metro area.	చెన్నై మెట్రోపాలిటన్ డెవలప్మెంట్ అథారిటీ (CMDA) మెట్రో ప్రాంతంలో పట్టణ ప్రణాళిక మరియు అభివృద్ధిని నిర్వహిస్తున్న నోడల్ ఏజెన్సీ.	80.0	en	telugu
The empire's war strategy rarely involved massive invasions; more often it employed small scale methods such as attacking and destroying individual forts.	సామ్రాజ్యం యొక్క యుద్ధ వ్యూహంలో భారీ దాడులు చాలా అరుదుగా ఉన్నాయి; తరచుగా ఇది చిన్న తరహా పద్ధతులను ఉపయోగించింది, ఉదాహరణకు వ్యక్తిగత కోటలను దాడి చేయడం మరియు నాశనం చేయడం.	80.0	en	telugu
According to the legendary text Mahabharata, the progenitors of the Kalingas and of their neighbouring tribes were brothers.	మహాభారతలో కలింగస్ మరియు వారి పొరుగు తెగల పూర్వీకులు సోదరులు అని చెబుతారు.	88.3333333333333	en	telugu
He hails from a distinguished family of freedom fighters.	ఆయన స్వాతంత్ర్య సమరయోధుల ప్రముఖ కుటుంబానికి చెందినవాడు.	58.3333333333333	en	telugu
Busy junctions are often equipped with bicycle-specific traffic lights.	రద్దీగా ఉండే విహారయాత్రలలో సైకిల్ కోసం ప్రత్యేకంగా ట్రాఫిక్ లైట్లు ఉంటాయి.	80.0	en	telugu
[citation needed] This is evidenced in adjacent cities of Rangpur, Rojdi, Rupar and Harappa in Punjab, Mohenjo-daro and Chanhudaro in Sindh.	[అనువాదం అవసరం] పంజాబ్లోని రాంగ్పూర్, రోజ్డి, రూపార్, హారప్ప, సింధ్లోని మొహెంజో-దారో, చాన్హుడారో వంటి పొరుగు నగరాల్లో ఇది సాక్ష్యంగా ఉంది.	75.0	en	telugu
Surfing is popular at some coastal towns.	కొన్ని తీర పట్టణాల్లో సర్ఫింగ్ ప్రసిద్ధి చెందింది.	90.0	en	telugu
The produced fuel has many properties that are similar to synthetic diesel, and are free from the many disadvantages of FAME.	ఉత్పత్తి చేయబడిన ఇంధనం సింథటిక్ డీజిల్కు సమానమైన అనేక లక్షణాలను కలిగి ఉంది మరియు FAME యొక్క అనేక అప్రయోజనాలు లేకుండా ఉంటుంది.	80.0	en	telugu
It also ranks high in life expectancy and in safe drinking water.	ఇది కూడా జీవిత కాలానికి మరియు సురక్షితమైన తాగునీటికి అధికంగా ఉంది.	65.0	en	telugu
"Later in his life he came under the influence of Ramakrishna and founded a syncretic ""New Dispensation"" inspired by Christianity, and Vaishnav bhakti, and Hindu practices."	"తరువాత తన జీవితంలో రామకృష్ణ ప్రభావానికి లోనయ్యాడు మరియు క్రైస్తవ మతం, వైష్ణవ్ భక్తి, హిందూ పద్ధతుల నుండి ప్రేరణ పొందిన సమకాలీన ""న్యూ డిస్పెన్సేషన్"" ను స్థాపించాడు."	70.0	en	telugu
From there, he then attacked Haripur and Ralaba.	అక్కడ నుండి హరిపూర్, రాబాలాపై దాడి చేశాడు.	70.0	en	telugu
Until 1998, Dantewada District was a tehsil of the larger Bastar District.	1998 వరకు, డాంటేవాడా జిల్లా పెద్ద బస్తర్ జిల్లా యొక్క తహసల్.	70.0	en	telugu
However, Kazakhstan is a member of the UEFA.	అయితే కజాఖ్స్తాన్ UEFA సభ్యదేశం.	60.0	en	telugu
It was formerly the seat of the eponymous princely state in the British Raj.	ఇది బ్రిటిష్ రాజ్యంలో అదే పేరుతో ఉన్న రాజ రాజ్యానికి గతంలో కేంద్ర స్థానం.	58.3333333333333	en	telugu
Organisms use glucose as a precursor for the synthesis of several important substances.	అనేక ముఖ్యమైన పదార్ధాల సంశ్లేషణకు జీవులందరూ గ్లూకోజ్ను ప్రక్కకు ఉపయోగించుకుంటారు.	66.6666666666667	en	telugu
Icelandic culture is founded upon the nation's Scandinavian heritage.	ఐస్లాండ్ సంస్కృతి స్కాండినేవియన్ వారసత్వంపై ఆధారపడి ఉంటుంది.	50.0	en	telugu
(Website) Madhepura is connected with road ways and railways.	మదhepura నగరం రహదారులు, రైల్వేలతో అనుసంధానించబడి ఉంది.	50.0	en	telugu
"), while Flood and Muesse follow the ""ancient, classical, mediaeval and modern periods"" periodisation."	"), ఫ్లోడ్, ముస్సే ""పురాతన, క్లాసిక్, మధ్యయుగ మరియు ఆధునిక కాలాలు"" యొక్క కాలక్రమానుసారం అనుసరిస్తాయి."	80.0	en	telugu
Bhaskar (Karthik) is a civil engineer who lives with a Christian family with Peter (Rajendra Prasad) and his sister Stella (Samyutha).	భస్కర్ (కార్తిక్) ఒక పౌర ఇంజనీర్. పీటర్ (రాజెంద్ర ప్రసాద్) మరియు అతని సోదరి స్టెల్లా (సమయుతా) తో కలిసి క్రైస్తవ కుటుంబంలో నివసిస్తున్నారు.	75.0	en	telugu
The country was divided into Uttara-Panchala and Dakshina-Panchala.	దేశాన్ని ఉత్తరా-పంచలా, దక్షినా-పంచలాగా విభజించారు.	68.3333333333333	en	telugu
In photography and image processing, color balance is the global adjustment of the intensities of the colors (typically red, green, and blue primary colors).	ఫోటోగ్రఫీ మరియు చిత్ర ప్రాసెసింగ్లో, రంగు సమతుల్యత అనేది రంగుల యొక్క తీవ్రత యొక్క ప్రపంచ సర్దుబాటు (సాధారణంగా ఎరుపు, ఆకుపచ్చ మరియు నీలం ప్రాధమిక రంగులు).	56.6666666666667	en	telugu
Jersey, the whole Channel Islands and the Cotentin peninsula (probably with the Avranchin) came formally under the control of the Duke of Brittany during the Viking invasions, because the king of the Franks was unable to defend them, however they remained in the archbishopric of Rouen.	జెర్సీ, మొత్తం ఛానల్ దీవులు మరియు కోటెంటిన్ ద్వీపం (అవ్రాన్చిన్లతో బహుశా) వైకింగ్ దండయాత్రల సమయంలో బ్రిటనీ డ్యూక్ నియంత్రణలో అధికారికంగా వచ్చింది, ఎందుకంటే ఫ్రాంక్ల రాజు వాటిని కాపాడుకోలేకపోయాడు, అయినప్పటికీ వారు రుయెన్ యొక్క ఆర్చ్బిషప్లో ఉండిపోయారు.	80.0	en	telugu
Kazakhstan has a bicameral parliament composed of the Majilis (the lower house) and senate (the upper house).	కజాఖ్స్తాన్ లో మజిలిస్ (తక్కువ సభ) మరియు సెనేట్ (ఎగువ సభ) తో కూడిన రెండు సభల పార్లమెంటు ఉంది.	80.0	en	telugu
Shavit is a space launch vehicle produced by Israel to launch small satellites into low Earth orbit.	షవిత్ అనేది ఇజ్రాయెల్ తయారు చేసిన ఒక అంతరిక్ష ప్రయోగ వాహనం. ఇది చిన్న ఉపగ్రహాలను భూమి తక్కువ కక్ష్యలోకి ప్రయోగించడానికి రూపొందించబడింది.	75.0	en	telugu
Aishwarya, the daughter of a wealthy entrepreneur, boards a flight back to Hyderabad from the United States.	సంపన్న వ్యాపారవేత్త కుమార్తె ఐశ్వర్య అమెరికా నుంచి హైదరాబాద్కు తిరిగి విమానంలో ప్రయాణిస్తోంది.	90.0	en	telugu
Tawang was historically part of Tibet.	తవాంగ్ చారిత్రాత్మకంగా టిబెట్లో భాగం.	90.0	en	telugu
in Europe (green & dark grey) Monaco (/ˈmɒnəkoʊ/ (listen); French pronunciation: ​[mɔnako]), officially the Principality of Monaco (French: Principauté de Monaco), is a sovereign city-state and microstate on the French Riviera close to the Italian region of Liguria, in Western Europe.	ఐరోపాలో (ఆకుపచ్చ & ముదురు గ్రే) మోనాకో (/ˈmɒnəkoʊ/ (నవ్వు); ఫ్రెంచ్ ఉచ్చారణః [mɔnako]), అధికారికంగా మోనాకో ప్రిన్సిపాలిటీ (ఫ్రెంచ్ః Principauté de Monaco), పశ్చిమ ఐరోపాలోని ఇటాలియన్ ప్రాంతమైన లిగురియా సమీపంలో ఫ్రెంచ్ రివియరాలో ఒక స్వతంత్ర నగరం-రాష్ట్రం మరియు మైక్రోస్టేట్.	70.0	en	telugu
A large part of the adult population, in particular women, is illiterate.	పెద్దల జనాభాలో, ముఖ్యంగా మహిళల్లో, పెద్ద భాగం అక్షరాస్యత.	48.3333333333333	en	telugu
It was also around this time that Gandhi joined vegetarian societies in London.	ఈ సమయంలో గాంధీ లండన్ లోని శాఖాహారం సమాజాలలో చేరారు.	75.0	en	telugu
The temple architecture reflects the glory of Kakatiya dynasty.	ఆలయ నిర్మాణం కాకతియా రాజవంశం యొక్క కీర్తిని ప్రతిబింబిస్తుంది.	90.0	en	telugu
His other names include Sindhula and Sindhala.	ఆయన ఇతర పేర్లు సింధులా, సింధాల.	80.0	en	telugu
