original	translation	mean	source_lang	target_lang
"Provinces or ""satrapy"" were established with provincial capitals: Gandhara satrapy, established 518 BC with its capital at Pushkalavati (Charsadda)."	"ప్రావిన్సుల రాజధానులతో ""సత్రాపీ"" లేదా ""సత్రాపీ"" స్థాపించబడ్డాయిః 518 BC లో పుష్కలావతి (చార్సదా) లో రాజధానితో స్థాపించబడిన గాంధరా సత్రాపీ."	76.6666666666667	en	telugu
According to Hindus, Baqi destroyed a pre-existing temple of Rama at the site.	హిందువుల ప్రకారం, బకీ ఈ ప్రదేశంలో రామ ఆలయాన్ని నాశనం చేశాడు.	90.0	en	telugu
"The text asserts that a physician should discuss his findings and questions with other physicians because ""when one discusses with another that is possessed of a knowledge of the same science, such discussion leads to increase of knowledge and happiness""."	"""ఒక వైద్యుడు తన పరిశోధనలను, ప్రశ్నలను ఇతర వైద్యులతో చర్చించుకోవాలి. ఎందుకంటే, ""ఒక వైద్యుడు అదే శాస్త్రం గురించి తెలిసిన మరొక వైద్యుడితో చర్చించినప్పుడు, అలాంటి చర్చ జ్ఞానం మరియు ఆనందాన్ని పెంచుతుంది"" అని ఆ గ్రంథం చెబుతుంది."	70.0	en	telugu
The Muslim historian Roz Khan Lodhi said that at Ashoka The Great built a Buddh Vihar and Quila; he named it BuddhMau (Budaun Fort).	ముస్లిం చరిత్రకారుడు రోజ్ ఖాన్ లోధి అశోకా ది గ్రేట్ వద్ద బౌద్ధ విహార్ మరియు క్యులేను నిర్మించాడని చెప్పారు; అతను దానిని బౌద్ధమౌ (బౌద్ధ కోట) అని పిలిచాడు.	85.0	en	telugu
The primary source of the life of Rama is the Sanskrit epic Ramayana composed by Rishi Valmiki.	రామా జీవితానికి ప్రధాన మూలం రిషి వాల్మికి రాసిన సంస్కృత పురాణ రామాయణం.	90.0	en	telugu
There are about 3,000 smallholder irrigation schemes covering a total area of 47,000 ha.	మొత్తం 47,000 హెక్టార్ల విస్తీర్ణంలో 3,000 కి పైగా చిన్న రైతుల నీటిపారుదల పథకాలు ఉన్నాయి.	90.0	en	telugu
He was the first member of the royal family to suggest fact-finding visits to the rural villages.	రాజ కుటుంబంలో మొదటి వ్యక్తిగా గ్రామీణ గ్రామాలకు వాస్తవాలను తెలుసుకోవడానికి ఆయనను సందర్శించాలని సూచించారు.	75.0	en	telugu
Anatomy (Greek anatomē, 'dissection') is the branch of biology concerned with the study of the structure of organisms and their parts.	శరీర నిర్మాణం (గ్రీకు అనటోమీ, 'డిసెక్షన్') అనేది జీవుల నిర్మాణం మరియు వాటి భాగాల అధ్యయనంతో సంబంధం ఉన్న జీవశాస్త్రం యొక్క శాఖ.	80.0	en	telugu
In many cases, however, vibration is undesirable, wasting energy and creating unwanted sound.	అయితే, చాలా సందర్భాలలో, కంపనం అవాంఛనీయమైనది, శక్తిని వృథా చేస్తుంది మరియు అవాంఛిత శబ్దాన్ని సృష్టిస్తుంది.	90.0	en	telugu
The district is named after the historical town of Murshidabad, which was named after Nawab Murshid Quli Khan.	ఈ జిల్లాకు నవాబ్ ముర్షిద్ కులి ఖాన్ పేరు పెట్టబడిన చారిత్రక ముర్షిదాబాద్ పట్టణం పేరు పెట్టబడింది.	95.0	en	telugu
The climate has extremes.	వాతావరణం తీవ్రమైనది.	90.0	en	telugu
For women, it is usually drawn on the palm, back of the hand and on feet, where the design will be clearest due to contrast with the lighter skin on these surfaces, which naturally contain less of the pigment melanin.	మహిళలకు, ఇది సాధారణంగా చేతిపక్కన, చేతి వెనుక మరియు అడుగుల మీద చిత్రించబడుతుంది, ఇక్కడ ఈ ఉపరితలాలపై తేలికైన చర్మంతో విరుద్ధంగా రూపకల్పన స్పష్టంగా ఉంటుంది, ఇవి సహజంగా మెలనిన్ యొక్క పిగ్మెంట్ను తక్కువగా కలిగి ఉంటాయి.	84.0	en	telugu
Important regions of the state also serve as district centers.	రాష్ట్రంలోని ముఖ్యమైన ప్రాంతాలు జిల్లా కేంద్రాలుగా కూడా పనిచేస్తాయి.	70.0	en	telugu
His education started in a traditional Sanskrit school in Doorvasapura and continued in Tirthahalli and Mysore.	ఆయన విద్యను ద్వారవసుపూరలోని సాంప్రదాయ సంస్కృత పాఠశాలలో ప్రారంభించి తృథాలీ, మైసూరులలో కొనసాగించారు.	65.0	en	telugu
(This first edition is available in facsimile.)	(ఈ మొదటి సంచిక ఫాక్స్ సమిలీలో లభిస్తుంది.)	78.3333333333333	en	telugu
However, during President's rule, the Council of Ministers is dissolved, vacating the office of Chief Minister.	అయితే, అధ్యక్షుడి పాలనలో, మంత్రుల మండలి రద్దు చేయబడుతుంది, ఇది ముఖ్యమంత్రి కార్యాలయాన్ని ఖాళీ చేస్తుంది.	70.0	en	telugu
The Hyderabad State Congress Party, affiliated to the Indian National Congress, launched a political agitation.	భారత జాతీయ కాంగ్రెస్ కు అనుబంధంగా ఉన్న హైదరాబాద్ రాష్ట్ర కాంగ్రెస్ పార్టీ రాజకీయ ఉద్యమాన్ని ప్రారంభించింది.	100.0	en	telugu
However, in early 2004, Boeing announced tentative plans for the 747 Advanced that were eventually adopted.	అయితే, 2004 ప్రారంభంలో, బోయింగ్ 747 అడ్వాన్స్డ్ కోసం తాత్కాలిక ప్రణాళికలను ప్రకటించింది, చివరికి ఇది స్వీకరించబడింది.	60.0	en	telugu
It was directed by Kennedy in the first season with Prabhu Deva as presenter, next seasons saw Benzene and Deepthi Reddy, Sanjay Nagaraju as directors.	ప్రభూదేవా ప్రెజెంటర్గా మొదటి సీజన్లో కెన్నెడీ దర్శకత్వం వహించారు. తరువాతి సీజన్లలో బెంజెన్, దీప్తి రెడ్డి, సంజయ్ నాగరాజు దర్శకులుగా ఉన్నారు.	90.0	en	telugu
The catalogue of horrors includes the disembowelling of pregnant women, the slamming of babies' heads against brick walls, the cutting off of the victim's limbs and genitalia, and the displaying of heads and corpses.	భయానక సంఘటనల జాబితాలో గర్భిణీ స్త్రీలను కత్తిరించడం, శిశువుల తలలను ఇటుక గోడలపై కొట్టడం, బాధితుడి అవయవాలు మరియు పురుషాంగాలను కత్తిరించడం, తలలు మరియు మృతదేహాలను ప్రదర్శించడం ఉన్నాయి.	73.3333333333333	en	telugu
In urban areas some women can be seen in western clothing.	పట్టణ ప్రాంతాల్లో కొన్ని మహిళలు పాశ్చాత్య దుస్తులు ధరించడం కనిపిస్తుంది.	100.0	en	telugu
Understanding the intentions and motives of others aids in the interpretation of communication, and the achievement of cooperative goals.	ఇతరుల ఉద్దేశాలు, ఉద్దేశాలను అర్థం చేసుకోవడం కమ్యూనికేషన్ యొక్క వ్యాఖ్యానానికి, సహకార లక్ష్యాల సాధనకు సహాయపడుతుంది.	90.0	en	telugu
Named Mahayogi Gorakhnath Airport.	మహయోగి గోరఖ్నాథ్ విమానాశ్రయం అని పేరు పెట్టారు.	80.0	en	telugu
The fossils (twenty one in total) include upper and lower jaws, cranial fragments, and the upper and lower parts of a leg bone (tibia).	శిలాజాలు (మొత్తం ఇరవై ఒక) ఎగువ మరియు దిగువ కండరాలు, మస్తిష్క ముక్కలు, మరియు ఒక కాళ్ళ ఎముక (టిబియా) యొక్క ఎగువ మరియు దిగువ భాగాలను కలిగి ఉంటాయి.	80.0	en	telugu
The soundtrack of the film is composed by Sricharan Pakala and lyrics by Ramajogayya Sastry.	ఈ సినిమా సౌండ్ట్రాక్ను శ్రీశారన్ పకాలా రాశారు. రామాజోగయ సాస్త్రి పాటలు రాశారు.	20.0	en	telugu
According to the Manjushrimulakalpa (c. 800 CE), king Narasimhsagupta became a Buddhist monk, and left the world through meditation (Dhyana).	మంజుష్రిములకల్పా ప్రకారం (సుమారు 800 CE), రాజు నారాసింహసాగుప్తా బౌద్ధ మంకుడిగా మారారు మరియు ధ్యాన (ధ్యాన) ద్వారా ప్రపంచాన్ని విడిచిపెట్టారు.	70.0	en	telugu
With much higher wages, many Salvadorans abroad can afford higher prices for houses in El Salvador than local Salvadorans, and thus push up the prices that all Salvadorans must pay.	విదేశాలలో ఉన్న అనేక మంది సాల్వడార్వాన్లు, స్థానిక సాల్వడార్వాన్ల కంటే ఎల్ సాల్వడార్లో ఉన్న ఇళ్ల ధరలను ఎక్కువగా కొనుగోలు చేయవచ్చు.	53.3333333333333	en	telugu
She posted a photograph of it on her Facebook wall and tagged some of her friends and challenged them to continue it.	ఆమె ఫేస్బుక్లో ఒక ఫోటోను పోస్ట్ చేసి, ఆమె స్నేహితులని ట్యాగ్ చేసి, దానిని కొనసాగించమని వారిని సవాలు చేసింది.	75.0	en	telugu
In addition to assassination and inciting riots, the militants encourage the populace to boycott elections.	హత్యలు, తిరుగుబాటులకు ప్రేరేపించడంతో పాటు, ఎన్నికలను బహిష్కరించమని తీవ్రవాదులు ప్రజలను ప్రోత్సహిస్తున్నారు.	70.0	en	telugu
There is some question about whether the fossils are from the late Jurassic or the early and mid Cretaceous age.	ఈ శిలాజాలు జురాసిక్ కాలం చివరినాటినా లేక క్రేటసిక్ యుగం ప్రారంభ మరియు మధ్యనాటినా అనే ప్రశ్న తలెత్తుతుంది.	90.0	en	telugu
The sex ratio was 863 females to 1000 males.	లింగ నిష్పత్తి 863 మంది స్త్రీలు 1000 మంది పురుషులకు సమానం.	71.6666666666667	en	telugu
The high officials of the university include the paridarshaka (visitor), pradhana (rector), acharya (chancellor), and the upacharya (vice-chancellor).	విశ్వవిద్యాలయంలోని ఉన్నత అధికారులలో పరిదార్షాకా (అతిథి), ప్రధానా (రెక్టర్), అచర్య (ఛాన్సలర్), మరియు ఉపచర్య (వైస్ ఛాన్సలర్) ఉన్నారు.	70.0	en	telugu
He has one younger brother named Khayyum, who is also an actor.	ఇతనికి ఖైయుమ్ అనే ఒక చిన్న సోదరుడు ఉన్నాడు, ఇతను కూడా నటుడు.	89.3333333333333	en	telugu
Later, when the Dutch used the island as a penal colony, new species were introduced to the island.	తరువాత, డచ్లు ఈ ద్వీపాన్ని శిక్షా కాలనీగా ఉపయోగించినప్పుడు, కొత్త జాతులు ఈ ద్వీపానికి ప్రవేశపెట్టబడ్డాయి.	83.3333333333333	en	telugu
A collection of computer programs, libraries, and related data are referred to as software.	కంప్యూటర్ ప్రోగ్రామ్లు, లైబ్రరీలు, మరియు సంబంధిత డేటా సేకరణను సాఫ్ట్వేర్ అని పిలుస్తారు.	80.0	en	telugu
This film plot is inspired by the Hindi film, Ab Tak Chhappan.	ఈ సినిమా ప్లాట్లు హిందీ సినిమా 'అబ్ టాక్ ఛాప్పన్' నుంచి ప్రేరణ పొందింది.	80.0	en	telugu
In addition to these, the students have to take compulsory advanced courses from other departments in order to broaden their education.	వీటితో పాటు విద్యార్ధులు తమ విద్యను విస్తరించేందుకు ఇతర విభాగాల నుంచి తప్పనిసరి అధునాతన కోర్సులు తీసుకోవాలి.	90.0	en	telugu
That part of the country then came to be known as North-Eastern Rhodesia.	ఆ దేశంలోని ఆ భాగం ఆ సమయంలో నార్త్ ఈస్ట్ రోడెసియా అని పిలువబడింది.	76.6666666666667	en	telugu
He is former Rajya Sabha Member of Parliament, former Member of Legislative Assembly and TDP vice president.	ఆయన రాజ్యసభ పార్లమెంటు సభ్యుడు, శాసనసభ సభ్యుడు, టిడిపి వైస్ ప్రెసిడెంట్.	90.0	en	telugu
The temple is patronised by a Senapati family.	ఈ ఆలయాన్ని సెనాపతి కుటుంబం ఆరాధించింది.	60.0	en	telugu
Vateria indica, the white dammar, is a species of tree in the family Dipterocarpaceae.	వాటారియా ఇండికా, తెలుపు డామర్, డిప్టెరోకార్పేసియా కుటుంబంలోని ఒక చెట్టు జాతి.	80.0	en	telugu
He simply switched from the medical field to the agricultural field.	అతను కేవలం వైద్య రంగం నుండి వ్యవసాయ రంగం కు మారిన.	58.3333333333333	en	telugu
Siwan town is the administrative headquarters of this district.	సివాన్ పట్టణం ఈ జిల్లా యొక్క పరిపాలనా ప్రధాన కార్యాలయం.	80.0	en	telugu
However Prithu became a great king.	అయితే ప్రితు గొప్ప రాజు అయ్యాడు.	90.0	en	telugu
He gave a convocation address at the National School of Drama, Delhi.	ఆయన ఢిల్లీలోని నేషనల్ స్కూల్ ఆఫ్ డ్రామా లో సమావేశ సభలో ప్రసంగించారు.	75.0	en	telugu
They could claim that the various signs of the ancient Tamil civilization had been lost in the deep ocean.	ప్రాచీన తమిళ నాగరికత యొక్క వివిధ సంకేతాలు సముద్రపు లోతులో పోయాయని వారు పేర్కొన్నారు.	70.0	en	telugu
That first fracture and repair had occurred the day before the accident.	ఆ మొదటి విచ్ఛిన్నం మరియు మరమ్మతు ప్రమాదం ముందు రోజు జరిగింది.	90.0	en	telugu
It can be launched either in a vertical or inclined position and is capable of covering targets over a 360-degree horizon.	ఇది నిలువుగా లేదా వంగిగా ప్రయోగించవచ్చు మరియు 360 డిగ్రీల కక్ష్యలో లక్ష్యాలను కవర్ చేయగలదు.	50.0	en	telugu
Doctors also invented several medical instruments, and even performed operations.	వైద్యులు అనేక వైద్య పరికరాలను కూడా కనుగొన్నారు, ఆపరేషన్లు కూడా చేశారు.	91.6666666666667	en	telugu
Its capital and largest city is Maseru.	దీని రాజధాని మరియు అతిపెద్ద నగరం మాసెరు.	60.0	en	telugu
The district headquarters are located in the town Khowai.	జిల్లా ప్రధాన కార్యాలయం ఖోవాయ్ పట్టణంలో ఉంది.	80.0	en	telugu
The amount of land reserved for indigenous peoples was later marginally increased.	స్థానిక ప్రజల కోసం నిల్వ చేయబడిన భూమి పరిమాణం తరువాత కొద్దిగా పెరిగింది.	79.6666666666667	en	telugu
It is the first major town after entering Himachal Pradesh on the way to Manali.	మనాలీకి వెళ్లే మార్గంలో హిమాచల్ ప్రదేశ్లోకి ప్రవేశించిన తరువాత ఇది మొదటి ప్రధాన పట్టణం.	70.0	en	telugu
"Moreover, he demonstrated that the protective cowpox pus could be effectively inoculated from person to person, not just directly from cattle."""	"అంతేకాక, ఆ రక్షణాత్మక కోవెవెవెప్స్ పిస్ను కేవలం పశువుల నుండినే కాకుండా, వ్యక్తి నుండి వ్యక్తికి సమర్థవంతంగా వ్యాక్సిన్ చేయవచ్చని ఆయన చూపించారు""."	90.0	en	telugu
Seafood has traditionally been important to the cuisine of Jersey: mussels (called moules in the island), oysters, lobster and crabs – especially spider crabs – ormers and conger.	జర్సీ వంటకానికి సముద్రపు పండ్లు సాంప్రదాయకంగా ముఖ్యమైనవిః మస్సెల్స్ (ద్వీపంలో మౌల్స్ అని పిలుస్తారు), ఓస్టెర్స్, లాస్ట్ మరియు క్రాబ్స్ ముఖ్యంగా స్పైడర్ క్రాబ్స్ ఓర్మెర్స్ మరియు కాంగెర్.	60.0	en	telugu
Mary Shelley's novel Frankenstein reflected concerns that scientific progress might be two-edged.	మేరీ షెల్లీ రాసిన ఫ్రాంక్నెస్టైన్ శాస్త్ర పురోగతి రెండు వైపులా ఉంటుందని ఆందోళన వ్యక్తం చేసింది.	70.0	en	telugu
Chintalapudi is a town and mandal headquarters in West Godavari district of the Indian state of Andhra Pradesh .	చింతపల్లి అనేది ఆంధ్రప్రదేశ్ రాష్ట్రంలోని పశ్చిమ గోదావరి జిల్లాలోని ఒక పట్టణం మరియు మండల ప్రధాన కార్యాలయం.	76.6666666666667	en	telugu
He passed matriculation from Mumbai University.	ముంబై విశ్వవిద్యాలయం నుంచి మాట్రిక్ పాస్ చేశారు.	60.0	en	telugu
Prasad (Chandra Mohan) a middle-class employee who stays along with his mother & sister, suffers from financial problems due to low income.	ప్రసాద్ (చంద్ర మోహన్) తన తల్లి, సోదరితో కలిసి ఉంటున్న మధ్యతరగతి ఉద్యోగి. తక్కువ ఆదాయం కారణంగా ఆర్థిక సమస్యలు ఎదుర్కొంటున్నాడు.	95.0	en	telugu
The deck is designed to enable aircraft such as the MiG-29K to operate from the carrier.	మిగ్-29కె వంటి విమానాలను విమానయాన సంస్థ నుండి ఆపరేట్ చేయడానికి ఈ డెక్ రూపొందించబడింది.	73.3333333333333	en	telugu
Hungary's geography has traditionally been defined by its two main waterways, the Danube and Tisza rivers.	హంగేరి యొక్క భౌగోళికం సాంప్రదాయకంగా దాని రెండు ప్రధాన జలమార్గాలు, డ్యూనాబ్ మరియు టిస్సా నదులు ద్వారా నిర్వచించబడింది.	90.0	en	telugu
During the Victorian and Edwardian eras, students in these schools consisted largely of children of the British colonial officials or soldiers.	విక్టోరియన్ మరియు ఎడ్వర్డియన్ యుగాలలో, ఈ పాఠశాలల్లో విద్యార్థులు ఎక్కువగా బ్రిటిష్ వలస అధికారులు లేదా సైనికుల పిల్లలతో ఉన్నారు.	80.0	en	telugu
It was the third of four Anglo–Mysore Wars.	ఇది నాలుగు ఆంగ్ల మిసోర్ యుద్ధాలలో మూడవది.	60.0	en	telugu
Jamaica has also produced several world class amateur and professional boxers including Trevor Berbick and Mike McCallum.	ట్రెవర్ బెర్బిక్ మరియు మైక్ మెక్కాల్మ్తో సహా ప్రపంచ స్థాయి ఔత్సాహిక మరియు ప్రొఫెషనల్ బాక్సర్లను కూడా జమైకా ఉత్పత్తి చేసింది.	85.0	en	telugu
Married to Kashyapa along with her 12 sisters.	ఆమె 12 సోదరీమణులతో పాటు కశ్యపాతో వివాహం చేసుకుంది.	80.0	en	telugu
Tirumala Devi was the most honoured wife of Krishnadevaraya.	తిరుమళ దేవి కృష్ణదేవరాయకు అత్యంత గౌరవనీయమైన భార్య.	60.0	en	telugu
Other notable stations include Palmer Station and Amundsen–Scott South Pole Station (United States), Esperanza Base and Marambio Base (Argentina), Scott Base (New Zealand), and Vostok Station (Russia).	ఇతర ప్రముఖ స్టేషన్లలో పాల్మెర్ స్టేషన్ మరియు అముండ్సెన్ స్కాట్ సౌత్ పోల్ స్టేషన్ (యునైటెడ్ స్టేట్స్), ఎస్పెరాంజా బేస్ మరియు మార్ంబియో బేస్ (అర్జెంటీనా), స్కాట్ బేస్ (న్యూజిలాండ్) మరియు వోస్టోక్ స్టేషన్ (రష్యా) ఉన్నాయి.	80.0	en	telugu
